{
  "matrix": {
    "dimensions": [
      {
        "name": "programInnovation",
        "displayName": "Program Innovation & Features",
        "weight": 1.5,
        "description": "Innovative program features, earning structures, and member benefits that differentiate from traditional models",
        "scoringCriteria": {
          "1": "Basic traditional program with standard earning and limited benefits",
          "2": "Some innovative features but mostly follows traditional model",
          "3": "Several innovative elements with competitive differentiation",
          "4": "Multiple industry-leading innovations and unique program features",
          "5": "Revolutionary program design setting new industry standards"
        },
        "evidenceRequirements": [
          "Program feature documentation",
          "Industry awards and recognition",
          "Member benefit descriptions",
          "Earning structure details"
        ],
        "marketSpecific": true
      },
      {
        "name": "networkReach",
        "displayName": "Network Reach & Partnerships",
        "weight": 1.3,
        "description": "Breadth of airline network, alliance benefits, and partner earning/redemption opportunities",
        "scoringCriteria": {
          "1": "Limited network, minimal partnerships, regional focus only",
          "2": "Regional network with some partnerships but limited global reach",
          "3": "Strong regional network or alliance membership with good coverage",
          "4": "Extensive global network through alliance or partnerships",
          "5": "Dominant global network coverage with comprehensive partnership ecosystem"
        },
        "evidenceRequirements": [
          "Route network coverage",
          "Alliance membership details",
          "Partner airline lists",
          "Geographic service areas"
        ],
        "marketSpecific": true
      },
      {
        "name": "memberValue",
        "displayName": "Member Value & Redemption",
        "weight": 1.4,
        "description": "Value proposition for members including redemption rates, award availability, and program benefits",
        "scoringCriteria": {
          "1": "Poor redemption value, limited availability, high fees",
          "2": "Below-average value with some restrictions and higher costs",
          "3": "Competitive value proposition with reasonable availability",
          "4": "Strong value offering with good availability and benefits",
          "5": "Exceptional value with excellent availability and member-friendly policies"
        },
        "evidenceRequirements": [
          "Award pricing examples",
          "Redemption availability data",
          "Fee structures",
          "Member benefit documentation"
        ],
        "marketSpecific": true
      },
      {
        "name": "customerExperience",
        "displayName": "Customer Experience & Service",
        "weight": 1.2,
        "description": "Quality of member service, digital experience, and overall program usability",
        "scoringCriteria": {
          "1": "Poor customer service, difficult program navigation, frequent issues",
          "2": "Below-average experience with some service limitations",
          "3": "Adequate customer experience with standard service levels",
          "4": "Good customer experience with responsive service and easy navigation",
          "5": "Exceptional customer experience with premium service and seamless digital experience"
        },
        "evidenceRequirements": [
          "Customer reviews and ratings",
          "Digital platform assessments",
          "Service quality indicators",
          "User experience features"
        ],
        "marketSpecific": false
      },
      {
        "name": "programScale",
        "displayName": "Program Scale & Market Position",
        "weight": 1.1,
        "description": "Member base size, market share, and overall program influence in the industry",
        "scoringCriteria": {
          "1": "Small member base, limited market presence, niche player",
          "2": "Regional presence with moderate member base",
          "3": "Established program with significant member base and market recognition",
          "4": "Large-scale program with strong market position and influence",
          "5": "Market-leading program with massive member base and industry dominance"
        },
        "evidenceRequirements": [
          "Member count data",
          "Market share information",
          "Industry rankings",
          "Revenue/financial indicators"
        ],
        "marketSpecific": false
      },
      {
        "name": "digitalInnovation",
        "displayName": "Digital Innovation & Technology",
        "weight": 1.2,
        "description": "Technology platform sophistication, mobile experience, and digital innovation capabilities",
        "scoringCriteria": {
          "1": "Outdated technology, poor mobile experience, limited digital features",
          "2": "Basic digital capabilities with some limitations",
          "3": "Modern digital platform with competitive features",
          "4": "Advanced digital experience with innovative features",
          "5": "Cutting-edge technology leadership with industry-leading digital innovations"
        },
        "evidenceRequirements": [
          "Mobile app reviews and features",
          "Website functionality assessment",
          "Digital innovation examples",
          "Technology platform capabilities"
        ],
        "marketSpecific": false
      }
    ],
    "competitors": [
      {
        "name": "Flying Blue (Air France-KLM)",
        "category": "Airline Alliance Leaders",
        "scores": {
          "programInnovation": {
            "score": 5,
            "confidence": "high",
            "evidence": [
              "World's #1 ranked loyalty program 2024-2025",
              "Ultimate tier with 8 companion benefits",
              "Dynamic pricing with monthly Promo Rewards",
              "Experience Points (XP) system innovation"
            ],
            "sources": [
              "https://thepointsguy.com/loyalty-programs/ultimate-guide-flying-blue/",
              "https://www.point.me/c/insights/worlds-best-airline-rewards-programs"
            ],
            "rationale": "Industry-leading innovations including Ultimate tier benefits and XP system",
            "lastUpdated": "2025-09-17"
          },
          "networkReach": {
            "score": 5,
            "confidence": "high",
            "evidence": [
              "SkyTeam alliance with 19 airlines",
              "Global coverage across 6 continents",
              "Extensive partnership network",
              "Strong Europe-Americas coverage"
            ],
            "sources": [
              "https://www.flyingblue.com",
              "https://www.skyteam.com"
            ],
            "rationale": "Comprehensive global network through SkyTeam alliance and extensive partnerships",
            "lastUpdated": "2025-09-17"
          },
          "memberValue": {
            "score": 5,
            "confidence": "high",
            "evidence": [
              "Dynamic pricing with saver rates available",
              "25% discount monthly Promo Rewards",
              "Miles never expire with activity",
              "No fuel surcharges on many routes"
            ],
            "sources": [
              "https://thepointsguy.com/loyalty-programs/ultimate-guide-flying-blue/"
            ],
            "rationale": "Exceptional value through dynamic pricing, Promo Rewards, and member-friendly policies",
            "lastUpdated": "2025-09-17"
          },
          "customerExperience": {
            "score": 4,
            "confidence": "high",
            "evidence": [
              "30 million members worldwide",
              "100,000+ new members monthly",
              "Strong digital platform",
              "Multiple language support"
            ],
            "sources": [
              "https://thepointsguy.com/loyalty-programs/ultimate-guide-flying-blue/"
            ],
            "rationale": "Strong customer experience evidenced by rapid growth and member retention",
            "lastUpdated": "2025-09-17"
          },
          "programScale": {
            "score": 5,
            "confidence": "high",
            "evidence": [
              "30+ million members",
              "World's largest airline group by revenue",
              "Global market leadership",
              "20-year program history"
            ],
            "sources": [
              "https://www.airfranceklm.com"
            ],
            "rationale": "Massive scale with industry-leading member base and global presence",
            "lastUpdated": "2025-09-17"
          },
          "digitalInnovation": {
            "score": 4,
            "confidence": "medium",
            "evidence": [
              "Modern mobile app",
              "Dynamic pricing technology",
              "Advanced partnership integrations",
              "Real-time award availability"
            ],
            "sources": [
              "https://www.flyingblue.com"
            ],
            "rationale": "Strong digital platform with innovative features and modern technology",
            "lastUpdated": "2025-09-17"
          }
        },
        "compositeScore": 4.7,
        "overallRanking": 1,
        "categoryRanking": 1,
        "strengths": [
          "Global #1 loyalty program ranking",
          "Revolutionary Ultimate tier benefits",
          "Comprehensive SkyTeam network",
          "Dynamic pricing innovation",
          "Massive member base and scale"
        ],
        "improvements": [
          "Complex XP system can be confusing",
          "Dynamic pricing unpredictability"
        ]
      },
      {
        "name": "American Airlines AAdvantage",
        "category": "Airline Alliance Leaders",